,Unnamed: 0,id,text,is_retweet,is_deleted,favorites,retweets,date,text_clean,lemmas
142,322,1.3268758636573614e+18,"It took long enough! What is taking North Carolina so long? Are they looking for more ballots to fix that one also? Now with a recount, we will win Georgia also. Pennsylvania & Michigan wouldn’t let our Poll Watchers & Observers into counting rooms. Illegal! https://t.co/TVTVv4s5Lx",False,False,170948,37345,2020-11-12,"It took long enough! What is taking North Carolina so long? Are they looking for more ballots to fix that one also? Now with a recount, we will win Georgia also. Pennsylvania & Michigan wouldn’t let our Poll Watchers & Observers into counting rooms. Illegal!","['it', 'take', 'long', 'enough', '!', 'what', 'be', 'take', 'north', 'carolina', 'so', 'long', '?', 'be', 'they', 'look', 'for', 'more', 'ballot', 'to', 'fix', 'that', 'one', 'also', '?', 'now', 'with', 'a', 'recount', ',', 'we', 'will', 'win', 'georgia', 'also', '.', 'pennsylvania', '&', 'michigan', 'would', 'not', 'let', 'our', 'poll', 'watchers', '&', 'observers', 'into', 'count', 'room', '.', 'illegal', '!']"
143,323,1.329093126238204e+18,"The Great State of Michigan, with votes being far greater than the number of people who voted, cannot certify the election. The Democrats cheated big time, and got caught. A Republican WIN!",False,False,314550,64121,2020-11-18,"The Great State of Michigan, with votes being far greater than the number of people who voted, cannot certify the election. The Democrats cheated big time, and got caught. A Republican WIN!","['the', 'great', 'state', 'of', 'michigan', ',', 'with', 'vote', 'be', 'far', 'great', 'than', 'the', 'number', 'of', 'people', 'who', 'vote', ',', 'can', 'not', 'certify', 'the', 'election', '.', 'the', 'democrats', 'cheat', 'big', 'time', ',', 'and', 'get', 'catch', '.', 'a', 'republican', 'win', '!']"
153,344,1.3335562429844316e+18,"Why is he rushing to put a Democrat in office, especially when so many horrible things concerning voter fraud are being revealed at the hearing going on right now. @OANN What is going on with @dougducey? Republicans will long remember! https://t.co/XILGaHcyw7",False,False,93921,25675,2020-11-30,"Why is he rushing to put a Democrat in office, especially when so many horrible things concerning voter fraud are being revealed at the hearing going on right now. What is going on with ? Republicans will long remember!","['why', 'be', 'he', 'rush', 'to', 'put', 'a', 'democrat', 'in', 'office', ',', 'especially', 'when', 'so', 'many', 'horrible', 'thing', 'concern', 'voter', 'fraud', 'be', 'be', 'reveal', 'at', 'the', 'hearing', 'go', 'on', 'right', 'now', '.', 'what', 'be', 'go', 'on', 'with', '?', 'republicans', 'will', 'long', 'remember', '!']"
156,351,1.333558147513e+18,...And there are many such articles. Rigged Election! https://t.co/P8scMauhcI,False,False,91750,22108,2020-11-30,...And there are many such articles. Rigged Election!,"['...', 'and', 'there', 'be', 'many', 'such', 'article', '.', 'rig', 'election', '!']"
159,358,1.3336102603811758e+18,Donald Trump Calls In to Arizona Voter Fraud Hearing: We‘re Fighting Back https://t.co/pzDS6YnwSf via @BreitbartNews. A very inspiring hearing. Such great support from both witnesses to election fraud and political leaders!,False,False,118000,23951,2020-12-01,Donald Trump Calls In to Arizona Voter Fraud Hearing: We‘re Fighting Back via . A very inspiring hearing. Such great support from both witnesses to election fraud and political leaders!,"['donald', 'trump', 'call', 'in', 'to', 'arizona', 'voter', 'fraud', 'hearing', ':', 'we‘re', 'fight', 'back', 'via', '.', 'a', 'very', 'inspiring', 'hearing', '.', 'such', 'great', 'support', 'from', 'both', 'witness', 'to', 'election', 'fraud', 'and', 'political', 'leader', '!']"
161,364,1.3336151519043953e+18,Not statistically possible. Rigged Election! https://t.co/Yw8roUTJhy,False,False,112396,24229,2020-12-01,Not statistically possible. Rigged Election!,"['not', 'statistically', 'possible', '.', 'rig', 'election', '!']"
165,372,1.331086969183621e+18,What does GSA being allowed to preliminarily work with the Dems have to do with continuing to pursue our various cases on what will go down as the most corrupt election in American political history? We are moving full speed ahead. Will never concede to fake ballots & “Dominion”.,False,False,344794,75668,2020-11-24,What does GSA being allowed to preliminarily work with the Dems have to do with continuing to pursue our various cases on what will go down as the most corrupt election in American political history? We are moving full speed ahead. Will never concede to fake ballots & “Dominion”.,"['what', 'do', 'gsa', 'be', 'allow', 'to', 'preliminarily', 'work', 'with', 'the', 'dems', 'have', 'to', 'do', 'with', 'continue', 'to', 'pursue', 'our', 'various', 'case', 'on', 'what', 'will', 'go', 'down', 'as', 'the', 'most', 'corrupt', 'election', 'in', 'american', 'political', 'history', '?', 'we', 'be', 'move', 'full', 'speed', 'ahead', '.', 'will', 'never', 'concede', 'to', 'fake', 'ballot', '&', '""', 'dominion', '""', '.']"
167,374,1.3312142479557386e+18,"Poll: 79 Percent of Trump Voters Believe ‘Election Was Stolen‘ https://t.co/PmMBmt05AI via @BreitbartNews They are 100% correct, but we are fighting hard. Our big lawsuit, which spells out in great detail all of the ballot fraud and more, will soon be filled. RIGGED ELECTION!",False,False,184222,44923,2020-11-24,"Poll: 79 Percent of Trump Voters Believe ‘Election Was Stolen‘ via They are 100% correct, but we are fighting hard. Our big lawsuit, which spells out in great detail all of the ballot fraud and more, will soon be filled. RIGGED ELECTION!","['poll', ':', '79', 'percent', 'of', 'trump', 'voters', 'believe', ""'"", 'election', 'be', 'steal', ""'"", 'via', 'they', 'be', '100', '%', 'correct', ',', 'but', 'we', 'be', 'fight', 'hard', '.', 'our', 'big', 'lawsuit', ',', 'which', 'spell', 'out', 'in', 'great', 'detail', 'all', 'of', 'the', 'ballot', 'fraud', 'and', 'more', ',', 'will', 'soon', 'be', 'fill', '.', 'rigged', 'election', '!']"
170,379,1.3270953987129467e+18,"Must see @seanhannity takedown of the horrible, inaccurate and anything but secure Dominion Voting System which is used in States where tens of thousands of votes were stolen from us and given to Biden. Likewise, the Great @LouDobbs has a confirming and powerful piece!",False,False,319244,65693,2020-11-13,"Must see takedown of the horrible, inaccurate and anything but secure Dominion Voting System which is used in States where tens of thousands of votes were stolen from us and given to Biden. Likewise, the Great has a confirming and powerful piece!","['must', 'see', 'takedown', 'of', 'the', 'horrible', ',', 'inaccurate', 'and', 'anything', 'but', 'secure', 'dominion', 'voting', 'system', 'which', 'be', 'use', 'in', 'states', 'where', 'ten', 'of', 'thousand', 'of', 'vote', 'be', 'steal', 'from', 'we', 'and', 'give', 'to', 'biden', '.', 'likewise', ',', 'the', 'great', 'have', 'a', 'confirming', 'and', 'powerful', 'piece', '!']"
176,389,1.3272799293194322e+18,"For years the Dems have been preaching how unsafe and rigged our elections have been. Now they are saying what a wonderful job the Trump Administration did in making 2020 the most secure election ever. Actually this is true, except for what the Democrats did. Rigged Election!",False,False,352073,68366,2020-11-13,"For years the Dems have been preaching how unsafe and rigged our elections have been. Now they are saying what a wonderful job the Trump Administration did in making 2020 the most secure election ever. Actually this is true, except for what the Democrats did. Rigged Election!","['for', 'year', 'the', 'dems', 'have', 'be', 'preach', 'how', 'unsafe', 'and', 'rig', 'our', 'election', 'have', 'be', '.', 'now', 'they', 'be', 'say', 'what', 'a', 'wonderful', 'job', 'the', 'trump', 'administration', 'do', 'in', 'make', '2020', 'the', 'most', 'secure', 'election', 'ever', '.', 'actually', 'this', 'be', 'true', ',', 'except', 'for', 'what', 'the', 'democrats', 'do', '.', 'rig', 'election', '!']"
179,392,1.3273192940578488e+18,"Heartwarming to see all of the tremendous support out there, especially the organic Rallies that are springing up all over the Country, including a big one on Saturday in D.C. I may even try to stop by and say hello. This Election was Rigged, from Dominion all the way up & down!",False,False,406299,81084,2020-11-13,"Heartwarming to see all of the tremendous support out there, especially the organic Rallies that are springing up all over the Country, including a big one on Saturday in D.C. I may even try to stop by and say hello. This Election was Rigged, from Dominion all the way up & down!","['heartwarme', 'to', 'see', 'all', 'of', 'the', 'tremendous', 'support', 'out', 'there', ',', 'especially', 'the', 'organic', 'rally', 'that', 'be', 'spring', 'up', 'all', 'over', 'the', 'country', ',', 'include', 'a', 'big', 'one', 'on', 'saturday', 'in', 'd.c.', 'i', 'may', 'even', 'try', 'to', 'stop', 'by', 'and', 'say', 'hello', '.', 'this', 'election', 'be', 'rig', ',', 'from', 'dominion', 'all', 'the', 'way', 'up', '&', 'down', '!']"
187,408,1.331393812728574e+18,"Why isn’t the @GASecofState Brad Raffensperger, a so-called Republican, allowing us to look at signatures on envelopes for verification? We will find tens of thousands of fraudulent and illegal votes...",False,False,179682,43561,2020-11-25,"Why isn’t the Brad Raffensperger, a so-called Republican, allowing us to look at signatures on envelopes for verification? We will find tens of thousands of fraudulent and illegal votes...","['why', 'be', 'not', 'the', 'brad', 'raffensperger', ',', 'a', 'so', '-', 'call', 'republican', ',', 'allow', 'we', 'to', 'look', 'at', 'signature', 'on', 'envelope', 'for', 'verification', '?', 'we', 'will', 'find', 'ten', 'of', 'thousand', 'of', 'fraudulent', 'and', 'illegal', 'vote', '...']"
188,412,1.3338570492943442e+18,Michigan voter fraud hearing going on now!,False,False,282968,37772,2020-12-01,Michigan voter fraud hearing going on now!,"['michigan', 'voter', 'fraud', 'hearing', 'go', 'on', 'now', '!']"
192,428,1.3274135349013504e+18,"Georgia Secretary of State, a so-called Republican (RINO), won’t let the people checking the ballots see the signatures for fraud. Why? Without this the whole process is very unfair and close to meaningless. Everyone knows that we won the state. Where is @BrianKempGA?",False,False,245831,62861,2020-11-14,"Georgia Secretary of State, a so-called Republican (RINO), won’t let the people checking the ballots see the signatures for fraud. Why? Without this the whole process is very unfair and close to meaningless. Everyone knows that we won the state. Where is ?","['georgia', 'secretary', 'of', 'state', ',', 'a', 'so', '-', 'call', 'republican', '(', 'rino', ')', ',', 'will', 'not', 'let', 'the', 'people', 'check', 'the', 'ballot', 'see', 'the', 'signature', 'for', 'fraud', '.', 'why', '?', 'without', 'this', 'the', 'whole', 'process', 'be', 'very', 'unfair', 'and', 'close', 'to', 'meaningless', '.', 'everyone', 'know', 'that', 'we', 'win', 'the', 'state', '.', 'where', 'be', '?']"
195,451,1.3339759915181875e+18,Rigged Election. Show signatures and envelopes. Expose the massive voter fraud in Georgia. What is Secretary of State and @BrianKempGA afraid of. They know what we’ll find!!! https://t.co/Km7tRm2s1A,False,False,105084,26701,2020-12-02,Rigged Election. Show signatures and envelopes. Expose the massive voter fraud in Georgia. What is Secretary of State and afraid of. They know what we’ll find!!!,"['rigged', 'election', '.', 'show', 'signature', 'and', 'envelope', '.', 'expose', 'the', 'massive', 'voter', 'fraud', 'in', 'georgia', '.', 'what', 'be', 'secretary', 'of', 'state', 'and', 'afraid', 'of', '.', 'they', 'know', 'what', 'we', '’ll', 'find', '!', '!', '!']"
201,483,1.3276196530201108e+18,"The Consent Decree signed by the Georgia Secretary of State, with the approval of Governor @BrianKempGA, at the urging of @staceyabrams, makes it impossible to check & match signatures on ballots and envelopes, etc. They knew they were going to cheat. Must expose real signatures!",False,False,252910,63921,2020-11-14,"The Consent Decree signed by the Georgia Secretary of State, with the approval of Governor , at the urging of , makes it impossible to check & match signatures on ballots and envelopes, etc. They knew they were going to cheat. Must expose real signatures!","['the', 'consent', 'decree', 'sign', 'by', 'the', 'georgia', 'secretary', 'of', 'state', ',', 'with', 'the', 'approval', 'of', 'governor', ',', 'at', 'the', 'urging', 'of', ',', 'make', 'it', 'impossible', 'to', 'check', '&', 'match', 'signature', 'on', 'ballot', 'and', 'envelope', ',', 'etc', '.', 'they', 'know', 'they', 'be', 'go', 'to', 'cheat', '.', 'must', 'expose', 'real', 'signature', '!']"
202,488,1.331684437705302e+18,I will be speaking before a very important Pennsylvania State Senate hearing which is in process now. Talking about the massive voter fraud which took place in the 2020 Election!,False,False,260124,48897,2020-11-25,I will be speaking before a very important Pennsylvania State Senate hearing which is in process now. Talking about the massive voter fraud which took place in the 2020 Election!,"['i', 'will', 'be', 'speak', 'before', 'a', 'very', 'important', 'pennsylvania', 'state', 'senate', 'hearing', 'which', 'be', 'in', 'process', 'now', '.', 'talk', 'about', 'the', 'massive', 'voter', 'fraud', 'which', 'take', 'place', 'in', 'the', '2020', 'election', '!']"
204,499,1.3341552859094098e+18,Big voter fraud hearings today in the Great State of Michigan. This election is a far bigger scandal (FRAUD!) than anyone would have thought - not even close. Watch today!,False,False,229617,50234,2020-12-02,Big voter fraud hearings today in the Great State of Michigan. This election is a far bigger scandal (FRAUD!) than anyone would have thought - not even close. Watch today!,"['big', 'voter', 'fraud', 'hearing', 'today', 'in', 'the', 'great', 'state', 'of', 'michigan', '.', 'this', 'election', 'be', 'a', 'far', 'big', 'scandal', '(', 'fraud', '!', ')', 'than', 'anyone', 'would', 'have', 'think', '-', 'not', 'even', 'close', '.', 'watch', 'today', '!']"
207,503,1.331738816856666e+18,“Data group exposes wide spread Mail-In Ballot Fraud.” @ChanelRion  @OANN,False,False,243446,52467,2020-11-25,“Data group exposes wide spread Mail-In Ballot Fraud.”,"['""', 'datum', 'group', 'expose', 'wide', 'spread', 'mail', '-', 'in', 'ballot', 'fraud', '.', '""']"
208,504,1.3277048419641836e+18,"People are not going to stand for having this Election stolen from them by a privately owned Radical Left company, Dominion, and many other reasons! https://t.co/RMOa4jKZwA",False,False,278755,66391,2020-11-14,"People are not going to stand for having this Election stolen from them by a privately owned Radical Left company, Dominion, and many other reasons!","['people', 'be', 'not', 'go', 'to', 'stand', 'for', 'have', 'this', 'election', 'steal', 'from', 'they', 'by', 'a', 'privately', 'own', 'radical', 'left', 'company', ',', 'dominion', ',', 'and', 'many', 'other', 'reason', '!']"
211,509,1.3277089986620252e+18,Hundreds of thousands of people showing their support in D.C. They will not stand for a Rigged and Corrupt Election! https://t.co/tr35WKTKM8,False,False,257965,58665,2020-11-14,Hundreds of thousands of people showing their support in D.C. They will not stand for a Rigged and Corrupt Election!,"['hundred', 'of', 'thousand', 'of', 'people', 'show', 'their', 'support', 'in', 'd.c.', 'they', 'will', 'not', 'stand', 'for', 'a', 'rigged', 'and', 'corrupt', 'election', '!']"
212,511,1.3277157679163924e+18,The hand recount taking place in Georgia is a waste of time. They are not showing the matching signatures. Call off the recount until they allow the MATCH. Don’t let the Radical Left Dems STEAL THE ELECTION!,False,False,302185,70205,2020-11-14,The hand recount taking place in Georgia is a waste of time. They are not showing the matching signatures. Call off the recount until they allow the MATCH. Don’t let the Radical Left Dems STEAL THE ELECTION!,"['the', 'hand', 'recount', 'take', 'place', 'in', 'georgia', 'be', 'a', 'waste', 'of', 'time', '.', 'they', 'be', 'not', 'show', 'the', 'matching', 'signature', '.', 'call', 'off', 'the', 'recount', 'until', 'they', 'allow', 'the', 'match', '.', 'do', 'not', 'let', 'the', 'radical', 'left', 'dems', 'steal', 'the', 'election', '!']"
214,514,1.3317500377775104e+18,Corrupt Election! https://t.co/MxNjfCEtKP,False,False,81631,18728,2020-11-26,Corrupt Election!,"['corrupt', 'election', '!']"
219,527,1.3277501276798894e+18,"There is tremendous evidence of wide spread voter fraud in that there is irrefutable proof that our Republican poll watchers and observers were not allowed to be present in poll counting rooms. Michigan, Pennsylvania, Georgia and others. Unconstitutional!",False,False,335013,71755,2020-11-14,"There is tremendous evidence of wide spread voter fraud in that there is irrefutable proof that our Republican poll watchers and observers were not allowed to be present in poll counting rooms. Michigan, Pennsylvania, Georgia and others. Unconstitutional!","['there', 'be', 'tremendous', 'evidence', 'of', 'wide', 'spread', 'voter', 'fraud', 'in', 'that', 'there', 'be', 'irrefutable', 'proof', 'that', 'our', 'republican', 'poll', 'watcher', 'and', 'observer', 'be', 'not', 'allow', 'to', 'be', 'present', 'in', 'poll', 'count', 'room', '.', 'michigan', ',', 'pennsylvania', ',', 'georgia', 'and', 'other', '.', 'unconstitutional', '!']"
232,560,1.3346115376888095e+18,"“Nevada 'fraud': 1,500 ‘dead’ voters, 42,248 voted ‘multiple times,’ RV camps as 'homes'” https://t.co/lBpB89tA3I",False,False,129760,38194,2020-12-03,"“Nevada 'fraud': 1,500 ‘dead’ voters, 42,248 voted ‘multiple times,’ RV cs as 'homes'”","['""', 'nevada', ""'"", 'fraud', ""'"", ':', '1,500', ""'"", 'dead', ""'"", 'voter', ',', '42,248', 'vote', ""'"", 'multiple', 'time', ',', ""'"", 'rv', 'cs', 'as', ""'"", 'home', ""'"", '""']"
239,574,1.3279564910562796e+18,"He won because the Election was Rigged. NO VOTE WATCHERS OR OBSERVERS allowed, vote tabulated by a Radical Left privately owned company, Dominion, with a bad reputation & bum equipment that couldn’t even qualify for Texas (which I won by a lot!), the Fake & Silent Media, & more! https://t.co/Exb3C1mAPg",False,False,154000,36622,2020-11-15,"He won because the Election was Rigged. NO VOTE WATCHERS OR OBSERVERS allowed, vote tabulated by a Radical Left privately owned company, Dominion, with a bad reputation & bum equipment that couldn’t even qualify for Texas (which I won by a lot!), the Fake & Silent Media, & more!","['he', 'win', 'because', 'the', 'election', 'be', 'rig', '.', 'no', 'vote', 'watcher', 'or', 'observer', 'allow', ',', 'vote', 'tabulate', 'by', 'a', 'radical', 'left', 'privately', 'own', 'company', ',', 'dominion', ',', 'with', 'a', 'bad', 'reputation', '&', 'bum', 'equipment', 'that', 'could', 'not', 'even', 'qualify', 'for', 'texas', '(', 'which', 'i', 'win', 'by', 'a', 'lot', '!', ')', ',', 'the', 'fake', '&', 'silent', 'media', ',', '&', 'more', '!']"
241,576,1.327958640309973e+18,"All of the mechanical “glitches” that took place on Election Night were really THEM getting caught trying to steal votes. They succeeded plenty, however, without getting caught. Mail-in elections are a sick joke!",False,False,269285,53371,2020-11-15,"All of the mechanical “glitches” that took place on Election Night were really THEM getting caught trying to steal votes. They succeeded plenty, however, without getting caught. Mail-in elections are a sick joke!","['all', 'of', 'the', 'mechanical', '""', 'glitch', '""', 'that', 'take', 'place', 'on', 'election', 'night', 'be', 'really', 'they', 'getting', 'catch', 'try', 'to', 'steal', 'vote', '.', 'they', 'succeed', 'plenty', ',', 'however', ',', 'without', 'getting', 'catch', '.', 'mail', '-', 'in', 'election', 'be', 'a', 'sick', 'joke', '!']"
250,607,1.3349916114036408e+18,Watch @SeanHannity tonight at 9:00 P.M. Eastern — story on Voter Fraud!,False,False,124057,20758,2020-12-04,Watch tonight at 9:00 P.M. Eastern — story on Voter Fraud!,"['watch', 'tonight', 'at', '9:00', 'p.m.', 'eastern', '—', 'story', 'on', 'voter', 'fraud', '!']"
253,614,1.328093294782509e+18,We won’t let a RIGGED ELECTION steal our Country! https://t.co/r0H4ZcDkHv,False,False,270740,62410,2020-11-15,We won’t let a RIGGED ELECTION steal our Country!,"['we', 'will', 'not', 'let', 'a', 'rigged', 'election', 'steal', 'our', 'country', '!']"
269,680,1.3354137701395497e+18,"The answer to the Democrat voter fraud is not to stay at home - that’s what Pelosi and Schumer want you to do. If you want revenge on the Democrats for their efforts to steal the Presidential election, where we are fighting hard, you have to show up and vote in RECORD numbers! https://t.co/XAJ0F2JmeL",False,False,166748,41785,2020-12-06,"The answer to the Democrat voter fraud is not to stay at home - that’s what Pelosi and Schumer want you to do. If you want revenge on the Democrats for their efforts to steal the Presidential election, where we are fighting hard, you have to show up and vote in RECORD numbers!","['the', 'answer', 'to', 'the', 'democrat', 'voter', 'fraud', 'be', 'not', 'to', 'stay', 'at', 'home', '-', 'that', '’', 'what', 'pelosi', 'and', 'schumer', 'want', 'you', 'to', 'do', '.', 'if', 'you', 'want', 'revenge', 'on', 'the', 'democrats', 'for', 'their', 'effort', 'to', 'steal', 'the', 'presidential', 'election', ',', 'where', 'we', 'be', 'fight', 'hard', ',', 'you', 'have', 'to', 'show', 'up', 'and', 'vote', 'in', 'record', 'number', '!']"
274,749,1.3356794265168814e+18,".@RudyGiuliani, by far the greatest mayor in the history of NYC, and who has been working tirelessly exposing the most corrupt election (by far!) in the history of the USA, has tested positive for the China Virus. Get better soon Rudy, we will carry on!!!",False,False,328966,57053,2020-12-06,"., by far the greatest mayor in the history of NYC, and who has been working tirelessly exposing the most corrupt election (by far!) in the history of the USA, has tested positive for the China Virus. Get better soon Rudy, we will carry on!!!","['.', ',', 'by', 'far', 'the', 'great', 'mayor', 'in', 'the', 'history', 'of', 'nyc', ',', 'and', 'who', 'have', 'be', 'work', 'tirelessly', 'expose', 'the', 'most', 'corrupt', 'election', '(', 'by', 'far', '!', ')', 'in', 'the', 'history', 'of', 'the', 'usa', ',', 'have', 'test', 'positive', 'for', 'the', 'china', 'virus', '.', 'get', 'well', 'soon', 'rudy', ',', 'we', 'will', 'carry', 'on', '!', '!', '!']"
276,762,1.3283614514976645e+18,"The Radical Left Democrats, working with their partner, the Fake News Media, are trying to STEAL this Election. We won’t let them!",False,False,344327,62658,2020-11-16,"The Radical Left Democrats, working with their partner, the Fake News Media, are trying to STEAL this Election. We won’t let them!","['the', 'radical', 'left', 'democrats', ',', 'work', 'with', 'their', 'partner', ',', 'the', 'fake', 'news', 'media', ',', 'be', 'try', 'to', 'steal', 'this', 'election', '.', 'we', 'will', 'not', 'let', 'they', '!']"
279,770,1.3357963933997752e+18,Watch @marklevinshow at 11:00 P.M. (now!) and @SteveHiltonx at 12:00 A.M. on the Great Election Fraud of 2020!,False,False,111167,20413,2020-12-07,Watch at 11:00 P.M. (now!) and at 12:00 A.M. on the Great Election Fraud of 2020!,"['watch', 'at', '11:00', 'p.m.', '(', 'now', '!', ')', 'and', 'at', '12:00', 'a.m.', 'on', 'the', 'great', 'election', 'fraud', 'of', '2020', '!']"
287,788,1.3361488364950692e+18,Georgia Lt. Governor @GeoffDuncanGA is a RINO Never Trumper who got himself elected as LG by falsely claiming to be “pro-Trump”. Too dumb or corrupt to recognize massive evidence of fraud in GA & should be replaced! We need every great Georgian to call him out! #SpecialSession!,False,False,151019,37472,2020-12-08,Georgia Lt. Governor is a RINO Never Trumper who got himself elected as LG by falsely claiming to be “pro-Trump”. Too dumb or corrupt to recognize massive evidence of fraud in GA & should be replaced! We need every great Georgian to call him out! SpecialSession!,"['georgia', 'lt', '.', 'governor', 'be', 'a', 'rino', 'never', 'trumper', 'who', 'get', 'himself', 'elect', 'as', 'lg', 'by', 'falsely', 'claim', 'to', 'be', '""', 'pro', '-', 'trump', '""', '.', 'too', 'dumb', 'or', 'corrupt', 'to', 'recognize', 'massive', 'evidence', 'of', 'fraud', 'in', 'ga', '&', 'should', 'be', 'replace', '!', 'we', 'need', 'every', 'great', 'georgian', 'to', 'call', 'he', 'out', '!', 'specialsession', '!']"
300,847,1.3366807135680717e+18,There is massive evidence of widespread fraud in the four states (plus) mentioned in the Texas suit. Just look at all of the tapes and affidavits!,False,False,193520,39561,2020-12-09,There is massive evidence of widespread fraud in the four states (plus) mentioned in the Texas suit. Just look at all of the tapes and affidavits!,"['there', 'be', 'massive', 'evidence', 'of', 'widespread', 'fraud', 'in', 'the', 'four', 'state', '(', 'plus', ')', 'mention', 'in', 'the', 'texas', 'suit', '.', 'just', 'look', 'at', 'all', 'of', 'the', 'tape', 'and', 'affidavit', '!']"
