,id,date,text,keyword,context,is_retweet,is_deleted,favorites,retweets,lemmas
59,1333405854297632770,2020-11-30,"I’m not fighting for me, I’m fighting for the 74,000,000 million people (not including the many Trump ballots that were “tossed”), a record for a sitting President, who voted for me!",fight,"I’m not fighting for me, I’m fighting for the 74,000,000 million",False,False,496088,84459,"['i', '’m', 'not', 'fight', 'for', 'i', ',', 'i', '’m', 'fight', 'for', 'the', '74,000,000', 'million', 'people', '(', 'not', 'include', 'the', 'many', 'trump', 'ballot', 'that', 'be', '""', 'toss', '""', ')', ',', 'a', 'record', 'for', 'a', 'sit', 'president', ',', 'who', 'vote', 'for', 'i', '!']"
60,1333405854297632770,2020-11-30,"I’m not fighting for me, I’m fighting for the 74,000,000 million people (not including the many Trump ballots that were “tossed”), a record for a sitting President, who voted for me!",fight,"I’m not fighting for me, I’m fighting for the 74,000,000 million people (not including the",False,False,496088,84459,"['i', '’m', 'not', 'fight', 'for', 'i', ',', 'i', '’m', 'fight', 'for', 'the', '74,000,000', 'million', 'people', '(', 'not', 'include', 'the', 'many', 'trump', 'ballot', 'that', 'be', '""', 'toss', '""', ')', ',', 'a', 'record', 'for', 'a', 'sit', 'president', ',', 'who', 'vote', 'for', 'i', '!']"
61,1333405854297632770,2020-11-30,"I’m not fighting for me, I’m fighting for the 74,000,000 million people (not including the many Trump ballots that were “tossed”), a record for a sitting President, who voted for me!",toss,"(not including the many Trump ballots that were “tossed”), a record for a sitting President, who voted",False,False,496088,84459,"['i', '’m', 'not', 'fight', 'for', 'i', ',', 'i', '’m', 'fight', 'for', 'the', '74,000,000', 'million', 'people', '(', 'not', 'include', 'the', 'many', 'trump', 'ballot', 'that', 'be', '""', 'toss', '""', ')', ',', 'a', 'record', 'for', 'a', 'sit', 'president', ',', 'who', 'vote', 'for', 'i', '!']"
62,1333410418119864320,2020-11-30,"Why won’t Governor @BrianKempGA, the hapless Governor of Georgia, use his emergency powers, which can be easily done, to overrule his obstinate Secretary of State, and do a match of signatures on envelopes. It will be a “goldmine” of fraud, and we will easily WIN the state....",goldmine,"of signatures on envelopes. It will be a “goldmine” of fraud, and we will easily WIN the",False,False,194596,46674,"['why', 'will', 'not', 'governor', ',', 'the', 'hapless', 'governor', 'of', 'georgia', ',', 'use', 'his', 'emergency', 'power', ',', 'which', 'can', 'be', 'easily', 'do', ',', 'to', 'overrule', 'his', 'obstinate', 'secretary', 'of', 'state', ',', 'and', 'do', 'a', 'match', 'of', 'signature', 'on', 'envelope', '.', 'it', 'will', 'be', 'a', '""', 'goldmine', '""', 'of', 'fraud', ',', 'and', 'we', 'will', 'easily', 'win', 'the', 'state', '....']"
63,1330374020613758977,2020-11-22,"Thanks Mark. It’s all a continuation of the never ending Witch Hunt. Judge Brann, who would not even allow us to present our case or evidence, is a product of Senator Pat “No Tariffs” Toomey of Pennsylvania, no friend of mine, &amp; Obama - No wonder. 900,000 Fraudulent Votes! https://t.co/17rk2KsUPs",witch,"It’s all a continuation of the never ending Witch Hunt. Judge Brann, who would not even allow",False,False,144982,30473,"['thank', 'mark', '.', 'it', '’', 'all', 'a', 'continuation', 'of', 'the', 'never', 'end', 'witch', 'hunt', '.', 'judge', 'brann', ',', 'who', 'would', 'not', 'even', 'allow', 'we', 'to', 'present', 'our', 'case', 'or', 'evidence', ',', 'be', 'a', 'product', 'of', 'senator', 'pat', '""', 'no', 'tariffs', '""', 'toomey', 'of', 'pennsylvania', ',', 'no', 'friend', 'of', 'mine', ',', '&', ';', 'obama', '-', 'no', 'wonder', '.', '900,000', 'fraudulent', 'votes', '!']"
64,1329087255168708608,2020-11-18,"In Detroit, there are FAR MORE VOTES THAN PEOPLE. Nothing can be done to cure that giant scam. I win Michigan!",cure,VOTES THAN PEOPLE. Nothing can be done to cure that giant scam. I win Michigan!,False,False,360087,69145,"['in', 'detroit', ',', 'there', 'be', 'far', 'more', 'vote', 'than', 'people', '.', 'nothing', 'can', 'be', 'do', 'to', 'cure', 'that', 'giant', 'scam', '.', 'i', 'win', 'michigan', '!']"
65,1329233502139715586,2020-11-19,"Look at this in Wisconsin! A day AFTER the election, Biden receives a dump of 143,379 votes at 3:42AM, when they learned he was losing badly. This is unbelievable! https://t.co/nhiLMmyHBn",dump,"A day AFTER the election, Biden receives a dump of 143,379 votes at 3:42AM, when they learned",False,False,369662,118380,"['look', 'at', 'this', 'in', 'wisconsin', '!', 'a', 'day', 'after', 'the', 'election', ',', 'biden', 'receive', 'a', 'dump', 'of', '143,379', 'vote', 'at', '3:42am', ',', 'when', 'they', 'learn', 'he', 'be', 'lose', 'badly', '.', 'this', 'be', 'unbelievable', '!']"
66,1333458950038106113,2020-11-30,Trump legal team in Arizona and on @OANN now. Big “stuff”. Enjoy!,stuff,team in Arizona and on @OANN now. Big “stuff”. Enjoy!,False,False,224550,35740,"['trump', 'legal', 'team', 'in', 'arizona', 'and', 'on', 'now', '.', 'big', '""', 'stuff', '""', '.', 'enjoy', '!']"
67,1333556242984431616,2020-11-30,"Why is he rushing to put a Democrat in office, especially when so many horrible things concerning voter fraud are being revealed at the hearing going on right now. @OANN What is going on with @dougducey? Republicans will long remember! https://t.co/XILGaHcyw7",put,"Why is he rushing to put a Democrat in office, especially when so many",False,False,93921,25675,"['why', 'be', 'he', 'rush', 'to', 'put', 'a', 'democrat', 'in', 'office', ',', 'especially', 'when', 'so', 'many', 'horrible', 'thing', 'concern', 'voter', 'fraud', 'be', 'be', 'reveal', 'at', 'the', 'hearing', 'go', 'on', 'right', 'now', '.', 'what', 'be', 'go', 'on', 'with', '?', 'republicans', 'will', 'long', 'remember', '!']"
68,1330487246236028935,2020-11-22,It’s all about the signatures on the envelopes. Why are the Democrats fighting so hard to hide them. We will find massive numbers of fraudulent ballots. The signatures won’t match. Fight hard Republicans. Don’t let them destroy the evidence! https://t.co/qN2jHGeWEN,destroy,won’t match. Fight hard Republicans. Don’t let them destroy the evidence! https://t.co/qN2jHGeWEN,False,False,155833,38419,"['it', '’', 'all', 'about', 'the', 'signature', 'on', 'the', 'envelope', '.', 'why', 'be', 'the', 'democrats', 'fight', 'so', 'hard', 'to', 'hide', 'they', '.', 'we', 'will', 'find', 'massive', 'number', 'of', 'fraudulent', 'ballot', '.', 'the', 'signature', 'will', 'not', 'match', '.', 'fight', 'hard', 'republicans', '.', 'do', 'not', 'let', 'they', 'destroy', 'the', 'evidence', '!']"
69,1330487246236028935,2020-11-22,It’s all about the signatures on the envelopes. Why are the Democrats fighting so hard to hide them. We will find massive numbers of fraudulent ballots. The signatures won’t match. Fight hard Republicans. Don’t let them destroy the evidence! https://t.co/qN2jHGeWEN,fight,signatures on the envelopes. Why are the Democrats fighting so hard to hide them. We will find,False,False,155833,38419,"['it', '’', 'all', 'about', 'the', 'signature', 'on', 'the', 'envelope', '.', 'why', 'be', 'the', 'democrats', 'fight', 'so', 'hard', 'to', 'hide', 'they', '.', 'we', 'will', 'find', 'massive', 'number', 'of', 'fraudulent', 'ballot', '.', 'the', 'signature', 'will', 'not', 'match', '.', 'fight', 'hard', 'republicans', '.', 'do', 'not', 'let', 'they', 'destroy', 'the', 'evidence', '!']"
70,1330487246236028935,2020-11-22,It’s all about the signatures on the envelopes. Why are the Democrats fighting so hard to hide them. We will find massive numbers of fraudulent ballots. The signatures won’t match. Fight hard Republicans. Don’t let them destroy the evidence! https://t.co/qN2jHGeWEN,fight,numbers of fraudulent ballots. The signatures won’t match. Fight hard Republicans. Don’t let them destroy the evidence!,False,False,155833,38419,"['it', '’', 'all', 'about', 'the', 'signature', 'on', 'the', 'envelope', '.', 'why', 'be', 'the', 'democrats', 'fight', 'so', 'hard', 'to', 'hide', 'they', '.', 'we', 'will', 'find', 'massive', 'number', 'of', 'fraudulent', 'ballot', '.', 'the', 'signature', 'will', 'not', 'match', '.', 'fight', 'hard', 'republicans', '.', 'do', 'not', 'let', 'they', 'destroy', 'the', 'evidence', '!']"
71,1330487246236028935,2020-11-22,It’s all about the signatures on the envelopes. Why are the Democrats fighting so hard to hide them. We will find massive numbers of fraudulent ballots. The signatures won’t match. Fight hard Republicans. Don’t let them destroy the evidence! https://t.co/qN2jHGeWEN,hide,Why are the Democrats fighting so hard to hide them. We will find massive numbers of fraudulent,False,False,155833,38419,"['it', '’', 'all', 'about', 'the', 'signature', 'on', 'the', 'envelope', '.', 'why', 'be', 'the', 'democrats', 'fight', 'so', 'hard', 'to', 'hide', 'they', '.', 'we', 'will', 'find', 'massive', 'number', 'of', 'fraudulent', 'ballot', '.', 'the', 'signature', 'will', 'not', 'match', '.', 'fight', 'hard', 'republicans', '.', 'do', 'not', 'let', 'they', 'destroy', 'the', 'evidence', '!']"
72,1333558773152161793,2020-11-30,Arizona hearings on live right now on @OANN. Such total corruption. So sad for our country!,country,@OANN. Such total corruption. So sad for our country!,False,False,225635,39427,"['arizona', 'hearing', 'on', 'live', 'right', 'now', 'on', '.', 'such', 'total', 'corruption', '.', 'so', 'sad', 'for', 'our', 'country', '!']"
73,1330499656003039232,2020-11-22,"Just arrived at Virtual G20. Was here yesterday also (early), but some of the Fake News Media failed to report it accurately - as usual. My speech is available (they said I didn’t make a speech).",fail,"(early), but some of the Fake News Media failed to report it accurately - as usual. My",False,False,328214,66354,"['just', 'arrive', 'at', 'virtual', 'g20', '.', 'be', 'here', 'yesterday', 'also', '(', 'early', ')', ',', 'but', 'some', 'of', 'the', 'fake', 'news', 'media', 'fail', 'to', 'report', 'it', 'accurately', '-', 'as', 'usual', '.', 'my', 'speech', 'be', 'available', '(', 'they', 'say', 'i', 'do', 'not', 'make', 'a', 'speech', ')', '.']"
74,1330499656003039232,2020-11-22,"Just arrived at Virtual G20. Was here yesterday also (early), but some of the Fake News Media failed to report it accurately - as usual. My speech is available (they said I didn’t make a speech).",media,"also (early), but some of the Fake News Media failed to report it accurately - as usual.",False,False,328214,66354,"['just', 'arrive', 'at', 'virtual', 'g20', '.', 'be', 'here', 'yesterday', 'also', '(', 'early', ')', ',', 'but', 'some', 'of', 'the', 'fake', 'news', 'media', 'fail', 'to', 'report', 'it', 'accurately', '-', 'as', 'usual', '.', 'my', 'speech', 'be', 'available', '(', 'they', 'say', 'i', 'do', 'not', 'make', 'a', 'speech', ')', '.']"
75,1330555645213483016,2020-11-22,"Other than politics, how do you lose a case where large numbers of voters, far more than you need to flip Pennsylvania, are disenfranchised? Vote Observers thrown out of counting rooms. People going to vote finding out they have already voted through a fake ballot - go home!",home,already voted through a fake ballot - go home!,False,False,271250,55418,"['other', 'than', 'politic', ',', 'how', 'do', 'you', 'lose', 'a', 'case', 'where', 'large', 'number', 'of', 'voter', ',', 'far', 'more', 'than', 'you', 'need', 'to', 'flip', 'pennsylvania', ',', 'be', 'disenfranchised', '?', 'vote', 'observers', 'throw', 'out', 'of', 'count', 'room', '.', 'people', 'go', 'to', 'vote', 'find', 'out', 'they', 'have', 'already', 'vote', 'through', 'a', 'fake', 'ballot', '-', 'go', 'home', '!']"
76,1330555645213483016,2020-11-22,"Other than politics, how do you lose a case where large numbers of voters, far more than you need to flip Pennsylvania, are disenfranchised? Vote Observers thrown out of counting rooms. People going to vote finding out they have already voted through a fake ballot - go home!",lose,"Other than politics, how do you lose a case where large numbers of voters, far",False,False,271250,55418,"['other', 'than', 'politic', ',', 'how', 'do', 'you', 'lose', 'a', 'case', 'where', 'large', 'number', 'of', 'voter', ',', 'far', 'more', 'than', 'you', 'need', 'to', 'flip', 'pennsylvania', ',', 'be', 'disenfranchised', '?', 'vote', 'observers', 'throw', 'out', 'of', 'count', 'room', '.', 'people', 'go', 'to', 'vote', 'find', 'out', 'they', 'have', 'already', 'vote', 'through', 'a', 'fake', 'ballot', '-', 'go', 'home', '!']"
77,1333610260381175813,2020-12-01,Donald Trump Calls In to Arizona Voter Fraud Hearing: We‘re Fighting Back https://t.co/pzDS6YnwSf via @BreitbartNews. A very inspiring hearing. Such great support from both witnesses to election fraud and political leaders!,fight,Calls In to Arizona Voter Fraud Hearing: We‘re Fighting Back https://t.co/pzDS6YnwSf via @BreitbartNews. A very inspiring hearing.,False,False,118000,23951,"['donald', 'trump', 'call', 'in', 'to', 'arizona', 'voter', 'fraud', 'hearing', ':', 'we‘re', 'fight', 'back', 'via', '.', 'a', 'very', 'inspiring', 'hearing', '.', 'such', 'great', 'support', 'from', 'both', 'witness', 'to', 'election', 'fraud', 'and', 'political', 'leader', '!']"
78,1331013908971261953,2020-11-23,"...fight, and I believe we will prevail! Nevertheless, in the best interest of our Country, I am recommending that Emily and her team do what needs to be done with regard to initial protocols, and have told my team to do the same.",country,"prevail! Nevertheless, in the best interest of our Country, I am recommending that Emily and her team",False,False,239911,35172,"['...', 'fight', ',', 'and', 'i', 'believe', 'we', 'will', 'prevail', '!', 'nevertheless', ',', 'in', 'the', 'good', 'interest', 'of', 'our', 'country', ',', 'i', 'be', 'recommend', 'that', 'emily', 'and', 'her', 'team', 'do', 'what', 'need', 'to', 'be', 'do', 'with', 'regard', 'to', 'initial', 'protocol', ',', 'and', 'have', 'tell', 'my', 'team', 'to', 'do', 'the', 'same', '.']"
79,1331013908971261953,2020-11-23,"...fight, and I believe we will prevail! Nevertheless, in the best interest of our Country, I am recommending that Emily and her team do what needs to be done with regard to initial protocols, and have told my team to do the same.",fight,"...fight, and I believe we will prevail! Nevertheless, in",False,False,239911,35172,"['...', 'fight', ',', 'and', 'i', 'believe', 'we', 'will', 'prevail', '!', 'nevertheless', ',', 'in', 'the', 'good', 'interest', 'of', 'our', 'country', ',', 'i', 'be', 'recommend', 'that', 'emily', 'and', 'her', 'team', 'do', 'what', 'need', 'to', 'be', 'do', 'with', 'regard', 'to', 'initial', 'protocol', ',', 'and', 'have', 'tell', 'my', 'team', 'to', 'do', 'the', 'same', '.']"
80,1331086969183621120,2020-11-24,What does GSA being allowed to preliminarily work with the Dems have to do with continuing to pursue our various cases on what will go down as the most corrupt election in American political history? We are moving full speed ahead. Will never concede to fake ballots &amp; “Dominion”.,concede,We are moving full speed ahead. Will never concede to fake ballots &amp; “Dominion”.,False,False,344794,75668,"['what', 'do', 'gsa', 'be', 'allow', 'to', 'preliminarily', 'work', 'with', 'the', 'dems', 'have', 'to', 'do', 'with', 'continue', 'to', 'pursue', 'our', 'various', 'case', 'on', 'what', 'will', 'go', 'down', 'as', 'the', 'most', 'corrupt', 'election', 'in', 'american', 'political', 'history', '?', 'we', 'be', 'move', 'full', 'speed', 'ahead', '.', 'will', 'never', 'concede', 'to', 'fake', 'ballot', '&', ';', '""', 'dominion', '""', '.']"
81,1331086969183621120,2020-11-24,What does GSA being allowed to preliminarily work with the Dems have to do with continuing to pursue our various cases on what will go down as the most corrupt election in American political history? We are moving full speed ahead. Will never concede to fake ballots &amp; “Dominion”.,history,as the most corrupt election in American political history? We are moving full speed ahead. Will never,False,False,344794,75668,"['what', 'do', 'gsa', 'be', 'allow', 'to', 'preliminarily', 'work', 'with', 'the', 'dems', 'have', 'to', 'do', 'with', 'continue', 'to', 'pursue', 'our', 'various', 'case', 'on', 'what', 'will', 'go', 'down', 'as', 'the', 'most', 'corrupt', 'election', 'in', 'american', 'political', 'history', '?', 'we', 'be', 'move', 'full', 'speed', 'ahead', '.', 'will', 'never', 'concede', 'to', 'fake', 'ballot', '&', ';', '""', 'dominion', '""', '.']"
82,1331086969183621120,2020-11-24,What does GSA being allowed to preliminarily work with the Dems have to do with continuing to pursue our various cases on what will go down as the most corrupt election in American political history? We are moving full speed ahead. Will never concede to fake ballots &amp; “Dominion”.,speed,in American political history? We are moving full speed ahead. Will never concede to fake ballots &amp;,False,False,344794,75668,"['what', 'do', 'gsa', 'be', 'allow', 'to', 'preliminarily', 'work', 'with', 'the', 'dems', 'have', 'to', 'do', 'with', 'continue', 'to', 'pursue', 'our', 'various', 'case', 'on', 'what', 'will', 'go', 'down', 'as', 'the', 'most', 'corrupt', 'election', 'in', 'american', 'political', 'history', '?', 'we', 'be', 'move', 'full', 'speed', 'ahead', '.', 'will', 'never', 'concede', 'to', 'fake', 'ballot', '&', ';', '""', 'dominion', '""', '.']"
83,1331214247955738624,2020-11-24,"Poll: 79 Percent of Trump Voters Believe ‘Election Was Stolen‘ https://t.co/PmMBmt05AI via @BreitbartNews They are 100% correct, but we are fighting hard. Our big lawsuit, which spells out in great detail all of the ballot fraud and more, will soon be filled. RIGGED ELECTION!",fight,"@BreitbartNews They are 100% correct, but we are fighting hard. Our big lawsuit, which spells out in",False,False,184222,44923,"['poll', ':', '79', 'percent', 'of', 'trump', 'voters', 'believe', ""'"", 'election', 'be', 'steal', ""'"", 'via', 'they', 'be', '100', '%', 'correct', ',', 'but', 'we', 'be', 'fight', 'hard', '.', 'our', 'big', 'lawsuit', ',', 'which', 'spell', 'out', 'in', 'great', 'detail', 'all', 'of', 'the', 'ballot', 'fraud', 'and', 'more', ',', 'will', 'soon', 'be', 'fill', '.', 'rigged', 'election', '!']"
84,1327103335195938817,2020-11-13,"These states in question should immediately be put in the Trump Win column. Biden did not win, he lost by a lot! https://t.co/ywiw6sPicI https://t.co/C1g9LZpMah",put,These states in question should immediately be put in the Trump Win column. Biden did not,False,False,190167,49317,"['these', 'state', 'in', 'question', 'should', 'immediately', 'be', 'put', 'in', 'the', 'trump', 'win', 'column', '.', 'biden', 'do', 'not', 'win', ',', 'he', 'lose', 'by', 'a', 'lot', '!']"
85,1331219093563781122,2020-11-24,"Thank you Randy, working hard to clean up the stench of the 2020 Election Hoax! https://t.co/I1hgtxe486",clean,"Thank you Randy, working hard to clean up the stench of the 2020 Election Hoax!",False,False,154989,32834,"['thank', 'you', 'randy', ',', 'work', 'hard', 'to', 'clean', 'up', 'the', 'stench', 'of', 'the', '2020', 'election', 'hoax', '!']"
86,1327319294057848832,2020-11-13,"Heartwarming to see all of the tremendous support out there, especially the organic Rallies that are springing up all over the Country, including a big one on Saturday in D.C. I may even try to stop by and say hello. This Election was Rigged, from Dominion all the way up &amp; down!",country,"Rallies that are springing up all over the Country, including a big one on Saturday in D.C.",False,False,406299,81084,"['heartwarme', 'to', 'see', 'all', 'of', 'the', 'tremendous', 'support', 'out', 'there', ',', 'especially', 'the', 'organic', 'rally', 'that', 'be', 'spring', 'up', 'all', 'over', 'the', 'country', ',', 'include', 'a', 'big', 'one', 'on', 'saturday', 'in', 'd.c.', 'i', 'may', 'even', 'try', 'to', 'stop', 'by', 'and', 'say', 'hello', '.', 'this', 'election', 'be', 'rig', ',', 'from', 'dominion', 'all', 'the', 'way', 'up', '&', ';', 'down', '!']"
87,1333856259662077954,2020-12-01,Hope everybody is watching @OANN right now. Other media afraid to show. People are coming forward like never before. Large truck carrying hundreds of thousands of fraudulent (FAKE) ballots to a voting center? TERRIBLE - SAVE AMERICA!,save,(FAKE) ballots to a voting center? TERRIBLE - SAVE AMERICA!,False,False,207415,51028,"['hope', 'everybody', 'be', 'watch', 'right', 'now', '.', 'other', 'medium', 'afraid', 'to', 'show', '.', 'people', 'be', 'come', 'forward', 'like', 'never', 'before', '.', 'large', 'truck', 'carry', 'hundred', 'of', 'thousand', 'of', 'fraudulent', '(', 'fake', ')', 'ballot', 'to', 'a', 'voting', 'center', '?', 'terrible', '-', 'save', 'america', '!']"
88,1331404288149643264,2020-11-25,"Should President Trump concede to Biden? Poll Results: No: 190,593  (98.9%) Yes: 2,181  (1.1%) Total Votes: 192,774. @gregkellyusa @newsmax For the good of our Country we must prevail!",concede,"Should President Trump concede to Biden? Poll Results: No: 190,593 (98.9%) Yes:",False,False,344113,62587,"['should', 'president', 'trump', 'concede', 'to', 'biden', '?', 'poll', 'result', ':', 'no', ':', '190,593', '(', '98.9', '%', ')', 'yes', ':', '2,181', '(', '1.1', '%', ')', 'total', 'vote', ':', '192,774', '.', 'for', 'the', 'good', 'of', 'our', 'country', 'we', 'must', 'prevail', '!']"
89,1331404288149643264,2020-11-25,"Should President Trump concede to Biden? Poll Results: No: 190,593  (98.9%) Yes: 2,181  (1.1%) Total Votes: 192,774. @gregkellyusa @newsmax For the good of our Country we must prevail!",country,"192,774. @gregkellyusa @newsmax For the good of our Country we must prevail!",False,False,344113,62587,"['should', 'president', 'trump', 'concede', 'to', 'biden', '?', 'poll', 'result', ':', 'no', ':', '190,593', '(', '98.9', '%', ')', 'yes', ':', '2,181', '(', '1.1', '%', ')', 'total', 'vote', ':', '192,774', '.', 'for', 'the', 'good', 'of', 'our', 'country', 'we', 'must', 'prevail', '!']"
90,1327436963658469376,2020-11-14,"“The worst thing you can do is bet against Donald Trump, considering what has been done against him. They flooded the zone with mail-in ballots. We need every vote counted, and ferociously.” @PeteHegseth @seanhannity",flood,considering what has been done against him. They flooded the zone with mail-in ballots. We need every,False,False,250108,50353,"['""', 'the', 'bad', 'thing', 'you', 'can', 'do', 'be', 'bet', 'against', 'donald', 'trump', ',', 'consider', 'what', 'have', 'be', 'do', 'against', 'he', '.', 'they', 'flood', 'the', 'zone', 'with', 'mail', '-', 'in', 'ballot', '.', 'we', 'need', 'every', 'vote', 'count', ',', 'and', 'ferociously', '.', '""']"
91,1333965375193624578,2020-12-02,"Section 230, which is a liability shielding gift from the U.S. to “Big Tech” (the only companies in America that have it - corporate welfare!), is a serious threat to our National Security &amp; Election Integrity. Our Country can never be safe &amp; secure if we allow it to stand.....",country,to our National Security &amp; Election Integrity. Our Country can never be safe &amp; secure if we,False,False,246723,57515,"['section', '230', ',', 'which', 'be', 'a', 'liability', 'shielding', 'gift', 'from', 'the', 'u.s.', 'to', '""', 'big', 'tech', '""', '(', 'the', 'only', 'company', 'in', 'america', 'that', 'have', 'it', '-', 'corporate', 'welfare', '!', ')', ',', 'be', 'a', 'serious', 'threat', 'to', 'our', 'national', 'security', '&', ';', 'election', 'integrity', '.', 'our', 'country', 'can', 'never', 'be', 'safe', '&', ';', 'secure', 'if', 'we', 'allow', 'it', 'to', 'stand', '.....']"
92,1333965375193624578,2020-12-02,"Section 230, which is a liability shielding gift from the U.S. to “Big Tech” (the only companies in America that have it - corporate welfare!), is a serious threat to our National Security &amp; Election Integrity. Our Country can never be safe &amp; secure if we allow it to stand.....",shielding,"Section 230, which is a liability shielding gift from the U.S. to “Big Tech” (the",False,False,246723,57515,"['section', '230', ',', 'which', 'be', 'a', 'liability', 'shielding', 'gift', 'from', 'the', 'u.s.', 'to', '""', 'big', 'tech', '""', '(', 'the', 'only', 'company', 'in', 'america', 'that', 'have', 'it', '-', 'corporate', 'welfare', '!', ')', ',', 'be', 'a', 'serious', 'threat', 'to', 'our', 'national', 'security', '&', ';', 'election', 'integrity', '.', 'our', 'country', 'can', 'never', 'be', 'safe', '&', ';', 'secure', 'if', 'we', 'allow', 'it', 'to', 'stand', '.....']"
93,1327638503883235332,2020-11-14,"....We cannot waste time and can only give to those states that will use the Vaccine immediately. Therefore the New York delay. Many lives to be saved, but we are ready when they are. Stop playing politics!",play,but we are ready when they are. Stop playing politics!,False,False,129507,24219,"['....', 'we', 'can', 'not', 'waste', 'time', 'and', 'can', 'only', 'give', 'to', 'those', 'state', 'that', 'will', 'use', 'the', 'vaccine', 'immediately', '.', 'therefore', 'the', 'new', 'york', 'delay', '.', 'many', 'live', 'to', 'be', 'save', ',', 'but', 'we', 'be', 'ready', 'when', 'they', 'be', '.', 'stop', 'play', 'politic', '!']"
