,id,date,text,keyword,context,is_retweet,is_deleted,favorites,retweets,lemmas
0,1327979630477922304,2020-11-15,He only won in the eyes of the FAKE NEWS MEDIA. I concede NOTHING! We have a long way to go. This was a RIGGED ELECTION!,long way to go,ing! we have a long way to go. this was a ri,False,False,572034,109164,"['he', 'only', 'win', 'in', 'the', 'eye', 'of', 'the', 'fake', 'news', 'media', '.', 'i', 'concede', 'nothing', '!', 'we', 'have', 'a', 'long', 'way', 'to', 'go', '.', 'this', 'be', 'a', 'rigged', 'election', '!']"
1,1325442336957018112,2020-11-08,"“We believe these people are thieves. The big city machines are corrupt. This was a stolen election. Best pollster in Britain wrote this morning that this clearly was a stolen election, that it’s impossible to imagine that Biden outran Obama in some of these states.",machines are corrupt,. the big city machines are corrupt. this was a st,False,False,516040,101484,"['""', 'we', 'believe', 'these', 'people', 'be', 'thief', '.', 'the', 'big', 'city', 'machine', 'be', 'corrupt', '.', 'this', 'be', 'a', 'steal', 'election', '.', 'good', 'pollster', 'in', 'britain', 'write', 'this', 'morning', 'that', 'this', 'clearly', 'be', 'a', 'steal', 'election', ',', 'that', 'it', '’', 'impossible', 'to', 'imagine', 'that', 'biden', 'outrun', 'obama', 'in', 'some', 'of', 'these', 'state', '.']"
2,1330368206968643584,2020-11-22,"“Dominion-izing the Vote”
Part Two via @OANN @ChanelRion 
https://t.co/HFvrnViseu",dominion-izing,“dominion-izing the vote” part,False,False,73209,21095,"['""', 'dominion', '-', 'ize', 'the', 'vote', '""', 'part', 'two', 'via']"
3,1330367988621594625,2020-11-22,"“Dominion-izing the Vote”
Part One via @OANN @ChanelRion 
https://t.co/7OtrKfoj6q",dominion-izing,“dominion-izing the vote” part,False,False,136743,41797,"['""', 'dominion', '-', 'ize', 'the', 'vote', '""', 'part', 'one', 'via']"
4,1330368448552169474,2020-11-22,"“Dominion-izing the Vote”
Part Three via @OANN @ChanelRion https://t.co/5En1SjPIol",dominion-izing,“dominion-izing the vote” part,False,False,70478,20578,"['""', 'dominion', '-', 'ize', 'the', 'vote', '""', 'part', 'three', 'via']"
5,1329298668403499009,2020-11-19,"""Dominion-izing the Vote"" https://t.co/ZOFsgDXsuH",dominion-izing,"""dominion-izing the vote""",False,False,187491,48992,"['""', 'dominion', '-', 'ize', 'the', 'vote', '""']"
6,1332552283553476608,2020-11-28,"The 1,126,940 votes were created out of thin air. I won Pennsylvania by a lot, perhaps more than anyone will ever know. The Pennsylvania votes were RIGGED. All other swing states also. The world is watching! https://t.co/zmnk34Ny23",world is watching,ates also. the world is watching!,False,False,264054,73949,"['the', '1,126,940', 'vote', 'be', 'create', 'out', 'of', 'thin', 'air', '.', 'i', 'win', 'pennsylvania', 'by', 'a', 'lot', ',', 'perhaps', 'more', 'than', 'anyone', 'will', 'ever', 'know', '.', 'the', 'pennsylvania', 'vote', 'be', 'rigged', '.', 'all', 'other', 'swing', 'state', 'also', '.', 'the', 'world', 'be', 'watch', '!']"
7,1330319750094860290,2020-11-22,"....the COURAGE to do what has to be done to maintain the integrity of our Elections,  and the United States of America itself. THE WORLD IS WATCHING!!!",world is watching,ca itself. the world is watching!!!,False,False,220447,39237,"['....', 'the', 'courage', 'to', 'do', 'what', 'have', 'to', 'be', 'do', 'to', 'maintain', 'the', 'integrity', 'of', 'our', 'elections', ',', 'and', 'the', 'united', 'states', 'of', 'america', 'itself', '.', 'the', 'world', 'be', 'watching', '!', '!', '!']"
8,1328152466752491526,2020-11-16,"....owned Dominion Voting Systems, turned down by Texas and many others because it was not good or secure, those responsible for the safeguarding of our Constitution cannot allow the Fake results of the 2020 Mail-In Election to stand. The World is watching!",world is watching, to stand. the world is watching!,False,False,189222,34749,"['....', 'own', 'dominion', 'voting', 'systems', ',', 'turn', 'down', 'by', 'texas', 'and', 'many', 'other', 'because', 'it', 'be', 'not', 'good', 'or', 'secure', ',', 'those', 'responsible', 'for', 'the', 'safeguarding', 'of', 'our', 'constitution', 'can', 'not', 'allow', 'the', 'fake', 'result', 'of', 'the', '2020', 'mail', '-', 'in', 'election', 'to', 'stand', '.', 'the', 'world', 'be', 'watch', '!']"
9,1346578706437963777,2021-01-05,"Washington is being inundated with people who don’t want to see an election victory stolen by emboldened Radical Left Democrats. Our Country has had enough, they won’t take it anymore! We hear you (and love you) from the Oval Office. MAKE AMERICA GREAT AGAIN!",america great,l office. make america great again!,False,False,328137,82574,"['washington', 'be', 'be', 'inundate', 'with', 'people', 'who', 'do', 'not', 'want', 'to', 'see', 'an', 'election', 'victory', 'steal', 'by', 'emboldened', 'radical', 'left', 'democrats', '.', 'our', 'country', 'have', 'have', 'enough', ',', 'they', 'will', 'not', 'take', 'it', 'anymore', '!', 'we', 'hear', 'you', '(', 'and', 'love', 'you', ')', 'from', 'the', 'oval', 'office', '.', 'make', 'america', 'great', 'again', '!']"
10,1323426413286952960,2020-11-03,"THANK YOU MICHIGAN! Tomorrow, you have the power, with your vote, to save AMERICA! So get your friends, get your family, get your neighbors and co-workers, and GET OUT AND VOTE! Together, WE will MAKE AMERICA GREAT AGAIN! https://t.co/r51nIlOrKx",america great,", we will make america great again!",False,False,85029,18597,"['thank', 'you', 'michigan', '!', 'tomorrow', ',', 'you', 'have', 'the', 'power', ',', 'with', 'your', 'vote', ',', 'to', 'save', 'america', '!', 'so', 'get', 'your', 'friend', ',', 'get', 'your', 'family', ',', 'get', 'your', 'neighbor', 'and', 'co', '-', 'worker', ',', 'and', 'get', 'out', 'and', 'vote', '!', 'together', ',', 'we', 'will', 'make', 'america', 'great', 'again', '!']"
11,1323475722032336896,2020-11-03,"Heading to GRAND RAPIDS, MICHIGAN after a great evening in KENOSHA, WISCONSIN! Get out and VOTE tomorrow, let’s MAKE AMERICA GREAT AGAIN! https://t.co/k6vyL1hLqL",america great,"ow, let’s make america great again!",False,False,106159,18157,"['head', 'to', 'grand', 'rapids', ',', 'michigan', 'after', 'a', 'great', 'evening', 'in', 'kenosha', ',', 'wisconsin', '!', 'get', 'out', 'and', 'vote', 'tomorrow', ',', 'let', '’s', 'make', 'america', 'great', 'again', '!']"
12,1334711509977608192,2020-12-04,"The best way to insure a @KLoeffler and @sendavidperdue VICTORY is to allow signature checks in the Presidential race, which will insure a Georgia Presidential win (very few votes are needed, many will be found). Spirits will soar and everyone will rush out and VOTE! @BrianKempGA",spirits will soar,ill be found). spirits will soar and everyone w,False,False,170738,39417,"['the', 'good', 'way', 'to', 'insure', 'a', 'and', 'victory', 'be', 'to', 'allow', 'signature', 'check', 'in', 'the', 'presidential', 'race', ',', 'which', 'will', 'insure', 'a', 'georgia', 'presidential', 'win', '(', 'very', 'few', 'vote', 'be', 'need', ',', 'many', 'will', 'be', 'find', ')', '.', 'spirit', 'will', 'soar', 'and', 'everyone', 'will', 'rush', 'out', 'and', 'vote', '!']"
13,1337040883988959232,2020-12-10,How can you give an election to someone who lost the election by hundreds of thousands of legal votes in each of the swing states. How can a country be run by an illegitimate president?,give an election,how can you give an election to someone who,False,False,228392,43954,"['how', 'can', 'you', 'give', 'an', 'election', 'to', 'someone', 'who', 'lose', 'the', 'election', 'by', 'hundred', 'of', 'thousand', 'of', 'legal', 'vote', 'in', 'each', 'of', 'the', 'swing', 'state', '.', 'how', 'can', 'a', 'country', 'be', 'run', 'by', 'an', 'illegitimate', 'president', '?']"
14,1342245390540804096,2020-12-24,"I saved at least 8 Republican Senators, including Mitch, from losing in the last Rigged (for President) Election. Now they (almost all) sit back and watch me fight against a crooked and vicious foe, the Radical Left Democrats. I will NEVER FORGET!",sit back,y (almost all) sit back and watch me f,False,False,336363,77029,"['i', 'save', 'at', 'least', '8', 'republican', 'senators', ',', 'include', 'mitch', ',', 'from', 'lose', 'in', 'the', 'last', 'rigged', '(', 'for', 'president', ')', 'election', '.', 'now', 'they', '(', 'almost', 'all', ')', 'sit', 'back', 'and', 'watch', 'i', 'fight', 'against', 'a', 'crooked', 'and', 'vicious', 'foe', ',', 'the', 'radical', 'left', 'democrats', '.', 'i', 'will', 'never', 'forget', '!']"
0,1325889532840062976,2020-11-09,"Nevada is turning out to be a cesspool of Fake Votes. @mschlapp &amp; @AdamLaxalt are finding things that, when released, will be absolutely shocking!",cesspool,Nevada is turning out to be a cesspool of Fake Votes. @mschlapp &amp; @AdamLaxalt are finding,False,False,363489,78378,"['nevada', 'be', 'turn', 'out', 'to', 'be', 'a', 'cesspool', 'of', 'fake', 'votes', '.', '&', ';', 'be', 'find', 'thing', 'that', ',', 'when', 'release', ',', 'will', 'be', 'absolutely', 'shocking', '!']"
1,1325895380983275524,2020-11-09,Pennsylvania prevented us from watching much of the Ballot count. Unthinkable and illegal in this country.,country,the Ballot count. Unthinkable and illegal in this country.,False,False,479292,81458,"['pennsylvania', 'prevent', 'we', 'from', 'watch', 'much', 'of', 'the', 'ballot', 'count', '.', 'unthinkable', 'and', 'illegal', 'in', 'this', 'country', '.']"
2,1346120645613150208,2021-01-04,"The “Surrender Caucus” within the Republican Party will go down in infamy as weak and ineffective “guardians” of our Nation, who were willing to accept the certification of fraudulent presidential numbers!",surrender,The “Surrender Caucus” within the Republican Party will go down,False,False,235516,60242,"['the', '""', 'surrender', 'caucus', '""', 'within', 'the', 'republican', 'party', 'will', 'go', 'down', 'in', 'infamy', 'as', 'weak', 'and', 'ineffective', '""', 'guardians', '""', 'of', 'our', 'nation', ',', 'who', 'be', 'willing', 'to', 'accept', 'the', 'certification', 'of', 'fraudulent', 'presidential', 'number', '!']"
3,1329054683441278977,2020-11-18,...AND I WON THE ELECTION. VOTER FRAUD ALL OVER THE COUNTRY! https://t.co/9coP3R44UQ,country,WON THE ELECTION. VOTER FRAUD ALL OVER THE COUNTRY! https://t.co/9coP3R44UQ,False,False,246973,54880,"['...', 'and', 'i', 'won', 'the', 'election', '.', 'voter', 'fraud', 'all', 'over', 'the', 'country', '!']"
4,1328328547598000130,2020-11-16,Dominion is running our Election. Rigged! https://t.co/xvwrpLpAZa,run,Dominion is running our Election. Rigged! https://t.co/xvwrpLpAZa,False,False,163578,40680,"['dominion', 'be', 'run', 'our', 'election', '.', 'rig', '!']"
5,1346469204740902915,2021-01-05,"Pleased to announce that @KLoeffler &amp; @sendavidperdue have just joined our great #StopTheSteal group of Senators. They will fight the ridiculous Electoral College Certification of Biden. How do you certify numbers that have now proven to be wrong and, in many cases, fraudulent!",fight,our great #StopTheSteal group of Senators. They will fight the ridiculous Electoral College Certification of Biden. How,False,False,177332,42347,"['pleased', 'to', 'announce', 'that', '&', ';', 'have', 'just', 'join', 'our', 'great', 'stopthesteal', 'group', 'of', 'senators', '.', 'they', 'will', 'fight', 'the', 'ridiculous', 'electoral', 'college', 'certification', 'of', 'biden', '.', 'how', 'do', 'you', 'certify', 'number', 'that', 'have', 'now', 'prove', 'to', 'be', 'wrong', 'and', ',', 'in', 'many', 'case', ',', 'fraudulent', '!']"
6,1325961672343875585,2020-11-10,"If Joe Biden were President, you wouldn’t have the Vaccine for another four years, nor would the @US_FDA have ever approved it so quickly. The bureaucracy would have destroyed millions of lives!",destroy,approved it so quickly. The bureaucracy would have destroyed millions of lives!,False,False,332731,56327,"['if', 'joe', 'biden', 'be', 'president', ',', 'you', 'would', 'not', 'have', 'the', 'vaccine', 'for', 'another', 'four', 'year', ',', 'nor', 'would', 'the', ' ', 'fda', 'have', 'ever', 'approve', 'it', 'so', 'quickly', '.', 'the', 'bureaucracy', 'would', 'have', 'destroy', 'million', 'of', 'life', '!']"
7,1346578706437963777,2021-01-05,"Washington is being inundated with people who don’t want to see an election victory stolen by emboldened Radical Left Democrats. Our Country has had enough, they won’t take it anymore! We hear you (and love you) from the Oval Office. MAKE AMERICA GREAT AGAIN!",country,"victory stolen by emboldened Radical Left Democrats. Our Country has had enough, they won’t take it anymore!",False,False,328137,82574,"['washington', 'be', 'be', 'inundate', 'with', 'people', 'who', 'do', 'not', 'want', 'to', 'see', 'an', 'election', 'victory', 'steal', 'by', 'emboldened', 'radical', 'left', 'democrats', '.', 'our', 'country', 'have', 'have', 'enough', ',', 'they', 'will', 'not', 'take', 'it', 'anymore', '!', 'we', 'hear', 'you', '(', 'and', 'love', 'you', ')', 'from', 'the', 'oval', 'office', '.', 'make', 'america', 'great', 'again', '!']"
8,1346578706437963777,2021-01-05,"Washington is being inundated with people who don’t want to see an election victory stolen by emboldened Radical Left Democrats. Our Country has had enough, they won’t take it anymore! We hear you (and love you) from the Oval Office. MAKE AMERICA GREAT AGAIN!",inundate,Washington is being inundated with people who don’t want to see an,False,False,328137,82574,"['washington', 'be', 'be', 'inundate', 'with', 'people', 'who', 'do', 'not', 'want', 'to', 'see', 'an', 'election', 'victory', 'steal', 'by', 'emboldened', 'radical', 'left', 'democrats', '.', 'our', 'country', 'have', 'have', 'enough', ',', 'they', 'will', 'not', 'take', 'it', 'anymore', '!', 'we', 'hear', 'you', '(', 'and', 'love', 'you', ')', 'from', 'the', 'oval', 'office', '.', 'make', 'america', 'great', 'again', '!']"
9,1346578706437963777,2021-01-05,"Washington is being inundated with people who don’t want to see an election victory stolen by emboldened Radical Left Democrats. Our Country has had enough, they won’t take it anymore! We hear you (and love you) from the Oval Office. MAKE AMERICA GREAT AGAIN!",victory,people who don’t want to see an election victory stolen by emboldened Radical Left Democrats. Our Country,False,False,328137,82574,"['washington', 'be', 'be', 'inundate', 'with', 'people', 'who', 'do', 'not', 'want', 'to', 'see', 'an', 'election', 'victory', 'steal', 'by', 'emboldened', 'radical', 'left', 'democrats', '.', 'our', 'country', 'have', 'have', 'enough', ',', 'they', 'will', 'not', 'take', 'it', 'anymore', '!', 'we', 'hear', 'you', '(', 'and', 'love', 'you', ')', 'from', 'the', 'oval', 'office', '.', 'make', 'america', 'great', 'again', '!']"
10,1346580318745206785,2021-01-05,"I hope the Democrats, and even more importantly, the weak and ineffective RINO section of the Republican Party, are looking at the thousands of people pouring into D.C. They won’t stand for a landslide election victory to be stolen. @senatemajldr @JohnCornyn @SenJohnThune",landslide,pouring into D.C. They won’t stand for a landslide election victory to be stolen. @senatemajldr @JohnCornyn @SenJohnThune,False,False,210988,55852,"['i', 'hope', 'the', 'democrats', ',', 'and', 'even', 'more', 'importantly', ',', 'the', 'weak', 'and', 'ineffective', 'rino', 'section', 'of', 'the', 'republican', 'party', ',', 'be', 'look', 'at', 'the', 'thousand', 'of', 'people', 'pour', 'into', 'd.c.', 'they', 'will', 'not', 'stand', 'for', 'a', 'landslide', 'election', 'victory', 'to', 'be', 'steal', '.']"
11,1346580318745206785,2021-01-05,"I hope the Democrats, and even more importantly, the weak and ineffective RINO section of the Republican Party, are looking at the thousands of people pouring into D.C. They won’t stand for a landslide election victory to be stolen. @senatemajldr @JohnCornyn @SenJohnThune",pour,"Party, are looking at the thousands of people pouring into D.C. They won’t stand for a landslide",False,False,210988,55852,"['i', 'hope', 'the', 'democrats', ',', 'and', 'even', 'more', 'importantly', ',', 'the', 'weak', 'and', 'ineffective', 'rino', 'section', 'of', 'the', 'republican', 'party', ',', 'be', 'look', 'at', 'the', 'thousand', 'of', 'people', 'pour', 'into', 'd.c.', 'they', 'will', 'not', 'stand', 'for', 'a', 'landslide', 'election', 'victory', 'to', 'be', 'steal', '.']"
12,1346580318745206785,2021-01-05,"I hope the Democrats, and even more importantly, the weak and ineffective RINO section of the Republican Party, are looking at the thousands of people pouring into D.C. They won’t stand for a landslide election victory to be stolen. @senatemajldr @JohnCornyn @SenJohnThune",victory,D.C. They won’t stand for a landslide election victory to be stolen. @senatemajldr @JohnCornyn @SenJohnThune,False,False,210988,55852,"['i', 'hope', 'the', 'democrats', ',', 'and', 'even', 'more', 'importantly', ',', 'the', 'weak', 'and', 'ineffective', 'rino', 'section', 'of', 'the', 'republican', 'party', ',', 'be', 'look', 'at', 'the', 'thousand', 'of', 'people', 'pour', 'into', 'd.c.', 'they', 'will', 'not', 'stand', 'for', 'a', 'landslide', 'election', 'victory', 'to', 'be', 'steal', '.']"
13,1329459995893764102,2020-11-19,"“Evidence of voter fraud continues to grow, including 20,000 dead people on the Pennsylvania voters roll and many thousands all over the Country. Now, there has been an artificial number of votes in favor of Joe Biden.” @OANN",country,"voters roll and many thousands all over the Country. Now, there has been an artificial number of",False,False,249157,58056,"['""', 'evidence', 'of', 'voter', 'fraud', 'continue', 'to', 'grow', ',', 'include', '20,000', 'dead', 'people', 'on', 'the', 'pennsylvania', 'voter', 'roll', 'and', 'many', 'thousand', 'all', 'over', 'the', 'country', '.', 'now', ',', 'there', 'have', 'be', 'an', 'artificial', 'number', 'of', 'vote', 'in', 'favor', 'of', 'joe', 'biden', '.', '""']"
14,1329424134166687744,2020-11-19,"Almost ZERO ballots rejected in Georgia this election. In years past, close to 4%. Not possible. Must have signature check on envelopes now. Very easy to do. Dems fighting because they got caught. Far more votes than needed for flip. Republicans must get tough! @BrianKempGA",fight,on envelopes now. Very easy to do. Dems fighting because they got caught. Far more votes than,False,False,217844,47813,"['almost', 'zero', 'ballot', 'reject', 'in', 'georgia', 'this', 'election', '.', 'in', 'year', 'past', ',', 'close', 'to', '4', '%', '.', 'not', 'possible', '.', 'must', 'have', 'signature', 'check', 'on', 'envelope', 'now', '.', 'very', 'easy', 'to', 'do', '.', 'dem', 'fight', 'because', 'they', 'get', 'catch', '.', 'far', 'more', 'vote', 'than', 'need', 'for', 'flip', '.', 'republican', 'must', 'get', 'tough', '!']"
15,1326186126709821440,2020-11-10,"WATCH FOR MASSIVE BALLOT COUNTING ABUSE AND, JUST LIKE THE EARLY VACCINE, REMEMBER I TOLD YOU SO!",abuse,"WATCH FOR MASSIVE BALLOT COUNTING ABUSE AND, JUST LIKE THE EARLY VACCINE, REMEMBER I",False,False,420361,74544,"['watch', 'for', 'massive', 'ballot', 'counting', 'abuse', 'and', ',', 'just', 'like', 'the', 'early', 'vaccine', ',', 'remember', 'i', 'tell', 'you', 'so', '!']"
16,1326186297157963777,2020-11-10,BALLOT COUNTING ABUSE!,abuse,BALLOT COUNTING ABUSE!,False,False,525218,77977,"['ballot', 'counting', 'abuse', '!']"
17,1346659909492998146,2021-01-06,Looks like they are setting up a big “voter dump” against the Republican candidates. Waiting to see how many votes they need?,dump,like they are setting up a big “voter dump” against the Republican candidates. Waiting to see how,False,False,331427,77805,"['look', 'like', 'they', 'be', 'set', 'up', 'a', 'big', '""', 'voter', 'dump', '""', 'against', 'the', 'republican', 'candidate', '.', 'wait', 'to', 'see', 'how', 'many', 'vote', 'they', 'need', '?']"
18,1326194143132082178,2020-11-10,"Republicans, don’t let Andrew McCabe continue to get away with totally criminal activity. What he did should never be allowed to happen to our Country again. FIGHT FOR JUSTICE!",country,should never be allowed to happen to our Country again. FIGHT FOR JUSTICE!,False,False,349531,69352,"['republican', ',', 'do', 'not', 'let', 'andrew', 'mccabe', 'continue', 'to', 'get', 'away', 'with', 'totally', 'criminal', 'activity', '.', 'what', 'he', 'do', 'should', 'never', 'be', 'allow', 'to', 'happen', 'to', 'our', 'country', 'again', '.', 'fight', 'for', 'justice', '!']"
19,1326194143132082178,2020-11-10,"Republicans, don’t let Andrew McCabe continue to get away with totally criminal activity. What he did should never be allowed to happen to our Country again. FIGHT FOR JUSTICE!",fight,be allowed to happen to our Country again. FIGHT FOR JUSTICE!,False,False,349531,69352,"['republican', ',', 'do', 'not', 'let', 'andrew', 'mccabe', 'continue', 'to', 'get', 'away', 'with', 'totally', 'criminal', 'activity', '.', 'what', 'he', 'do', 'should', 'never', 'be', 'allow', 'to', 'happen', 'to', 'our', 'country', 'again', '.', 'fight', 'for', 'justice', '!']"
20,1332169753004224515,2020-11-27,"I gave a long news conference today after wishing the military a Happy Thanksgiving, &amp; realized once again that the Fake News Media coordinates so that the real message of such a conference never gets out. Primary point made was that the 2020 Election was RIGGED, and that I WON!",media,&amp; realized once again that the Fake News Media coordinates so that the real message of such,False,False,274247,59077,"['i', 'give', 'a', 'long', 'news', 'conference', 'today', 'after', 'wish', 'the', 'military', 'a', 'happy', 'thanksgiving', ',', '&', ';', 'realize', 'once', 'again', 'that', 'the', 'fake', 'news', 'media', 'coordinate', 'so', 'that', 'the', 'real', 'message', 'of', 'such', 'a', 'conference', 'never', 'get', 'out', '.', 'primary', 'point', 'make', 'be', 'that', 'the', '2020', 'election', 'be', 'rigged', ',', 'and', 'that', 'i', 'won', '!']"
21,1346805405998075905,2021-01-06,Sleepy Eyes Chuck Todd is so happy with the fake voter tabulation process that he can’t even get the words out straight. Sad to watch!,sleepy,Sleepy Eyes Chuck Todd is so happy with the,False,False,193930,36209,"['sleepy', 'eyes', 'chuck', 'todd', 'be', 'so', 'happy', 'with', 'the', 'fake', 'voter', 'tabulation', 'process', 'that', 'he', 'can', 'not', 'even', 'get', 'the', 'word', 'out', 'straight', '.', 'sad', 'to', 'watch', '!']"
22,1346809349214248962,2021-01-06,"THE REPUBLICAN PARTY AND, MORE IMPORTANTLY, OUR COUNTRY, NEEDS THE PRESIDENCY MORE THAN EVER BEFORE - THE POWER OF THE VETO. STAY STRONG!",country,"THE REPUBLICAN PARTY AND, MORE IMPORTANTLY, OUR COUNTRY, NEEDS THE PRESIDENCY MORE THAN EVER BEFORE -",False,False,344390,66595,"['the', 'republican', 'party', 'and', ',', 'more', 'importantly', ',', 'our', 'country', ',', 'needs', 'the', 'presidency', 'more', 'than', 'ever', 'before', '-', 'the', 'power', 'of', 'the', 'veto', '.', 'stay', 'strong', '!']"
23,1346818855298072576,2021-01-06,"They just happened to find 50,000 ballots late last night. The USA is embarrassed by fools. Our Election Process is worse than that of third world countries!",usa,"to find 50,000 ballots late last night. The USA is embarrassed by fools. Our Election Process is",False,False,377295,92437,"['they', 'just', 'happen', 'to', 'find', '50,000', 'ballot', 'late', 'last', 'night', '.', 'the', 'usa', 'be', 'embarrass', 'by', 'fool', '.', 'our', 'election', 'process', 'be', 'bad', 'than', 'that', 'of', 'third', 'world', 'country', '!']"
24,1326342742801326083,2020-11-11,"Andrew McCabe was exposed for who he is today in the U.S. Senate. He was totally destroyed - an ignorant fool. The great people of the FBI must make sure that he and his former boss, James Comey, pay the price for what they have done to the reputation of the FBI.",destroy,today in the U.S. Senate. He was totally destroyed - an ignorant fool. The great people of,False,False,293356,61658,"['andrew', 'mccabe', 'be', 'expose', 'for', 'who', 'he', 'be', 'today', 'in', 'the', 'u.s.', 'senate', '.', 'he', 'be', 'totally', 'destroy', '-', 'an', 'ignorant', 'fool', '.', 'the', 'great', 'people', 'of', 'the', 'fbi', 'must', 'make', 'sure', 'that', 'he', 'and', 'his', 'former', 'boss', ',', 'james', 'comey', ',', 'pay', 'the', 'price', 'for', 'what', 'they', 'have', 'do', 'to', 'the', 'reputation', 'of', 'the', 'fbi', '.']"
25,1346900434540240897,2021-01-06,"Mike Pence didn’t have the courage to do what should have been done to protect our Country and our Constitution, giving States a chance to certify a corrected set of facts, not the fraudulent or inaccurate ones which they were asked to previously certify. USA demands the truth!",country,"what should have been done to protect our Country and our Constitution, giving States a chance to",False,False,0,0,"['mike', 'pence', 'do', 'not', 'have', 'the', 'courage', 'to', 'do', 'what', 'should', 'have', 'be', 'do', 'to', 'protect', 'our', 'country', 'and', 'our', 'constitution', ',', 'give', 'state', 'a', 'chance', 'to', 'certify', 'a', 'correct', 'set', 'of', 'fact', ',', 'not', 'the', 'fraudulent', 'or', 'inaccurate', 'one', 'which', 'they', 'be', 'ask', 'to', 'previously', 'certify', '.', 'usa', 'demand', 'the', 'truth', '!']"
